ETF_Ticker,ticker,name,weight,Holdings_As_Of,Date_Scraped
PIE,TPE: 2345,Accton Technology Corporation,0.0349,2026-03-27,2026-03-27
PIE,TPE: 2330,Taiwan Semiconductor Manufacturing Company Limited,0.0313,2026-03-27,2026-03-27
PIE,TERA.E.IS,Tera Yatirim Menkul Degerler AS,0.0262,2026-03-27,2026-03-27
PIE,TPE: 5434,"Topco Scientific Co.,Ltd.",0.024900000000000002,2026-03-27,2026-03-27
PIE,TPE: 2404,"United Integrated Services Co., Ltd.",0.0241,2026-03-27,2026-03-27
PIE,TPE: 6257,Sigurd Microelectronics Corporation,0.0226,2026-03-27,2026-03-27
PIE,TISCO-R.BK,TISCO Financial Group PCL Units Non-Voting Depository Receipt,0.0222,2026-03-27,2026-03-27
PIE,BMV: GENTERA,"Gentera, S.A.B. de C.V.",0.0216,2026-03-27,2026-03-27
PIE,TPE: 6691,"Yankey Engineering Co., Ltd.",0.0207,2026-03-27,2026-03-27
PIE,TPE: 8112,"Supreme Electronics Co., Ltd.",0.0197,2026-03-27,2026-03-27
PIE,TPE: 6515,"WinWay Technology Co., Ltd.",0.0177,2026-03-27,2026-03-27
PIE,BVMF: CURY3,Cury Construtora e Incorporadora S.A.,0.017,2026-03-27,2026-03-27
PIE,HKG: 1898,China Coal Energy Company Limited,0.0169,2026-03-27,2026-03-27
PIE,HKG: 1088,China Shenhua Energy Company Limited,0.016,2026-03-27,2026-03-27
PIE,TPE: 3665,BizLink Holding Inc.,0.0155,2026-03-27,2026-03-27
PIE,IDX: ENRG,PT Energi Mega Persada Tbk,0.015300000000000001,2026-03-27,2026-03-27
PIE,TPE: 2408,Nanya Technology Corporation,0.0152,2026-03-27,2026-03-27
PIE,HKG: 0857,PetroChina Company Limited,0.015,2026-03-27,2026-03-27
PIE,TPE: 2344,Winbond Electronics Corporation,0.0149,2026-03-27,2026-03-27
PIE,6944.TWO,Mega Union Technology Inc,0.0144,2026-03-27,2026-03-27
PIE,TPE: 6191,Global Brands Manufacture Ltd.,0.014199999999999999,2026-03-27,2026-03-27
PIE,ICT.PM,International Container Terminal Services Inc,0.013600000000000001,2026-03-27,2026-03-27
PIE,BVMF: DIRR3,Direcional Engenharia S.A.,0.013500000000000002,2026-03-27,2026-03-27
PIE,JSE: VKE,Vukile Property Fund Limited,0.013000000000000001,2026-03-27,2026-03-27
PIE,HKG: 1378,China Hongqiao Group Limited,0.0126,2026-03-27,2026-03-27
