ETF_Ticker,ticker,name,weight,Holdings_As_Of,Date_Scraped
PIE,TPE: 2345,Accton Technology Corporation,0.0315,2026-03-11,2026-03-12
PIE,TPE: 2330,Taiwan Semiconductor Manufacturing Company Limited,0.0305,2026-03-11,2026-03-12
PIE,TPE: 2404,"United Integrated Services Co., Ltd.",0.027000000000000003,2026-03-11,2026-03-12
PIE,TPE: 5434,"Topco Scientific Co.,Ltd.",0.0248,2026-03-11,2026-03-12
PIE,TERA.E.IS,Tera Yatirim Menkul Degerler AS,0.0231,2026-03-11,2026-03-12
PIE,TPE: 6257,Sigurd Microelectronics Corporation,0.0225,2026-03-11,2026-03-12
PIE,TISCO-R.BK,TISCO Financial Group PCL Units Non-Voting Depository Receipt,0.0223,2026-03-11,2026-03-12
PIE,TPE: 6691,"Yankey Engineering Co., Ltd.",0.021,2026-03-11,2026-03-12
PIE,BMV: GENTERA,"Gentera, S.A.B. de C.V.",0.0207,2026-03-11,2026-03-12
PIE,IDX: ENRG,PT Energi Mega Persada Tbk,0.0191,2026-03-11,2026-03-12
PIE,TPE: 6919,"Caliway Biopharmaceuticals Co., Ltd.",0.0179,2026-03-11,2026-03-12
PIE,BVMF: CURY3,Cury Construtora e Incorporadora S.A.,0.0169,2026-03-11,2026-03-12
PIE,TPE: 8112,"Supreme Electronics Co., Ltd.",0.016399999999999998,2026-03-11,2026-03-12
PIE,HKG: 1898,China Coal Energy Company Limited,0.016200000000000003,2026-03-11,2026-03-12
PIE,TPE: 2408,Nanya Technology Corporation,0.015,2026-03-11,2026-03-12
PIE,HKG: 1088,China Shenhua Energy Company Limited,0.015,2026-03-11,2026-03-12
PIE,TPE: 3665,BizLink Holding Inc.,0.0147,2026-03-11,2026-03-12
PIE,TPE: 6191,Global Brands Manufacture Ltd.,0.0146,2026-03-11,2026-03-12
PIE,TPE: 2344,Winbond Electronics Corporation,0.014499999999999999,2026-03-11,2026-03-12
PIE,HKG: 0857,PetroChina Company Limited,0.0144,2026-03-11,2026-03-12
PIE,BVMF: DIRR3,Direcional Engenharia S.A.,0.0144,2026-03-11,2026-03-12
PIE,ICT.PM,International Container Terminal Services Inc,0.014199999999999999,2026-03-11,2026-03-12
PIE,JSE: VKE,Vukile Property Fund Limited,0.0138,2026-03-11,2026-03-12
PIE,HKG: 1378,China Hongqiao Group Limited,0.0138,2026-03-11,2026-03-12
PIE,6944.TWO,Mega Union Technology Inc,0.013600000000000001,2026-03-11,2026-03-12
