ETF_Ticker,ticker,name,weight,Holdings_As_Of,Date_Scraped
PIE,,Taiwan Dollar,0.0432,2026-04-02,2026-04-03
PIE,TPE: 2345,Accton Technology Corporation,0.0353,2026-04-02,2026-04-03
PIE,TPE: 2330,Taiwan Semiconductor Manufacturing Company Limited,0.0311,2026-04-02,2026-04-03
PIE,TERA.E.IS,Tera Yatirim Menkul Degerler AS,0.0282,2026-04-02,2026-04-03
PIE,TPE: 6257,Sigurd Microelectronics Corporation,0.0273,2026-04-02,2026-04-03
PIE,TPE: 5434,"Topco Scientific Co.,Ltd.",0.0242,2026-04-02,2026-04-03
PIE,TISCO-R.BK,TISCO Financial Group PCL Units Non-Voting Depository Receipt,0.022099999999999998,2026-04-02,2026-04-03
PIE,BMV: GENTERA,"Gentera, S.A.B. de C.V.",0.0219,2026-04-02,2026-04-03
PIE,TPE: 2404,"United Integrated Services Co., Ltd.",0.0218,2026-04-02,2026-04-03
PIE,TPE: 6691,"Yankey Engineering Co., Ltd.",0.019299999999999998,2026-04-02,2026-04-03
PIE,TPE: 8112,"Supreme Electronics Co., Ltd.",0.018600000000000002,2026-04-02,2026-04-03
PIE,BVMF: CURY3,Cury Construtora e Incorporadora S.A.,0.0171,2026-04-02,2026-04-03
PIE,TPE: 3665,BizLink Holding Inc.,0.016200000000000003,2026-04-02,2026-04-03
PIE,TPE: 6515,"WinWay Technology Co., Ltd.",0.0161,2026-04-02,2026-04-03
PIE,IDX: ENRG,PT Energi Mega Persada Tbk,0.016,2026-04-02,2026-04-03
PIE,HKG: 1898,China Coal Energy Company Limited,0.0159,2026-04-02,2026-04-03
PIE,HKG: 1088,China Shenhua Energy Company Limited,0.015600000000000001,2026-04-02,2026-04-03
PIE,HKG: 0857,PetroChina Company Limited,0.015,2026-04-02,2026-04-03
PIE,TPE: 2408,Nanya Technology Corporation,0.0146,2026-04-02,2026-04-03
PIE,6944.TWO,Mega Union Technology Inc,0.0143,2026-04-02,2026-04-03
PIE,TPE: 6191,Global Brands Manufacture Ltd.,0.0141,2026-04-02,2026-04-03
PIE,TPE: 2344,Winbond Electronics Corporation,0.013999999999999999,2026-04-02,2026-04-03
PIE,ICT.PM,International Container Terminal Services Inc,0.0134,2026-04-02,2026-04-03
PIE,HKG: 1378,China Hongqiao Group Limited,0.013000000000000001,2026-04-02,2026-04-03
PIE,JSE: VKE,Vukile Property Fund Limited,0.013000000000000001,2026-04-02,2026-04-03
