ETF_Ticker,ticker,name,weight,Holdings_As_Of,Date_Scraped
PIE,TPE: 2330,Taiwan Semiconductor Manufacturing Company Limited,0.030699999999999998,2026-02-27,2026-03-01
PIE,TPE: 2345,Accton Technology Corporation,0.0287,2026-02-27,2026-03-01
PIE,TPE: 2404,"United Integrated Services Co., Ltd.",0.0265,2026-02-27,2026-03-01
PIE,TPE: 5434,"Topco Scientific Co.,Ltd.",0.025,2026-02-27,2026-03-01
PIE,TPE: 6257,Sigurd Microelectronics Corporation,0.0248,2026-02-27,2026-03-01
PIE,TISCO-R.BK,TISCO Financial Group PCL Units Non-Voting Depository Receipt,0.0219,2026-02-27,2026-03-01
PIE,TPE: 6691,"Yankey Engineering Co., Ltd.",0.0215,2026-02-27,2026-03-01
PIE,BMV: GENTERA,"Gentera, S.A.B. de C.V.",0.0207,2026-02-27,2026-03-01
PIE,TPE: 6919,"Caliway Biopharmaceuticals Co., Ltd.",0.0202,2026-02-27,2026-03-01
PIE,TERA.E.IS,Tera Yatirim Menkul Degerler AS,0.02,2026-02-27,2026-03-01
PIE,TPE: 2408,Nanya Technology Corporation,0.0179,2026-02-27,2026-03-01
PIE,BVMF: CURY3,Cury Construtora e Incorporadora S.A.,0.0177,2026-02-27,2026-03-01
PIE,TPE: 8112,"Supreme Electronics Co., Ltd.",0.0165,2026-02-27,2026-03-01
PIE,TPE: 2344,Winbond Electronics Corporation,0.0161,2026-02-27,2026-03-01
PIE,IDX: ENRG,PT Energi Mega Persada Tbk,0.0158,2026-02-27,2026-03-01
PIE,TPE: 6191,Global Brands Manufacture Ltd.,0.0155,2026-02-27,2026-03-01
PIE,BVMF: DIRR3,Direcional Engenharia S.A.,0.015,2026-02-27,2026-03-01
PIE,JSE: VKE,Vukile Property Fund Limited,0.0144,2026-02-27,2026-03-01
PIE,ICT.PM,International Container Terminal Services Inc,0.013500000000000002,2026-02-27,2026-03-01
PIE,HKG: 1258,China Nonferrous Mining Corporation Limited,0.0134,2026-02-27,2026-03-01
PIE,HKG: 1898,China Coal Energy Company Limited,0.0134,2026-02-27,2026-03-01
PIE,HKG: 1088,China Shenhua Energy Company Limited,0.013300000000000001,2026-02-27,2026-03-01
PIE,6944.TWO,Mega Union Technology Inc,0.0131,2026-02-27,2026-03-01
PIE,GMEXICOB.MX,Grupo Mexico SAB de CV Class B,0.0124,2026-02-27,2026-03-01
PIE,HKG: 1378,China Hongqiao Group Limited,0.012199999999999999,2026-02-27,2026-03-01
