ETF_Ticker,ticker,name,weight,Holdings_As_Of,Date_Scraped
PIE,2345,Accton Technology Corp,0.0371,2026-04-23,2026-04-25
PIE,6196,Marketech International Corp,0.0305,2026-04-23,2026-04-25
PIE,5434,Topco Scientific Co Ltd,0.030299999999999997,2026-04-23,2026-04-25
PIE,2330,Taiwan Semiconductor Manufacturing Co Ltd,0.0297,2026-04-23,2026-04-25
PIE,2404,United Integrated Services Co Ltd,0.028300000000000002,2026-04-23,2026-04-25
PIE,6257,Sigurd Microelectronics Corp,0.027999999999999997,2026-04-23,2026-04-25
PIE,6691,Yankey Engineering Co Ltd,0.0233,2026-04-23,2026-04-25
PIE,TISCO-R,Tisco Financial Group PCL,0.0227,2026-04-23,2026-04-25
PIE,6515,WinWay Technology Co Ltd,0.0217,2026-04-23,2026-04-25
PIE,3665,Bizlink Holding Inc,0.020099999999999996,2026-04-23,2026-04-25
