ETF_Ticker,ticker,name,weight,Holdings_As_Of,Date_Scraped
PIE,2345,Accton Technology Corp,0.0329,2026-04-13,2026-04-16
PIE,5434,Topco Scientific Co Ltd,0.0294,2026-04-13,2026-04-16
PIE,2330,Taiwan Semiconductor Manufacturing Co Ltd,0.027999999999999997,2026-04-13,2026-04-16
PIE,6257,Sigurd Microelectronics Corp,0.0279,2026-04-13,2026-04-16
PIE,2404,United Integrated Services Co Ltd,0.0264,2026-04-13,2026-04-16
PIE,6196,Marketech International Corp,0.0264,2026-04-13,2026-04-16
PIE,TISCO-R,Tisco Financial Group PCL,0.023700000000000002,2026-04-13,2026-04-16
PIE,6691,Yankey Engineering Co Ltd,0.022000000000000002,2026-04-13,2026-04-16
PIE,ASELS,Aselsan Elektronik Sanayi Ve Ticaret AS,0.0204,2026-04-13,2026-04-16
PIE,GENTERA*,Gentera SAB de CV,0.02,2026-04-13,2026-04-16
